{
  "repo_commit_hash": "2443da713d70fa19205e3fe44709884bb429cd03",
  "command_run": "x3-proof verify x3.dex.liquidity_provision",
  "artifact_hash": "d84cebea7990cf0e250f1da1bd0d3523555399abed5a321dd5bf7a36b3502305",
  "policy_hash": "a9560e648e6673ee0512a7122dd3518720b654814ce0f4e8d8327dc18379237a",
  "relevant_files": [
    "crates/x3-dex/src/lib.rs",
    "crates/x3-dex/src/tests/attack_sandwich.rs",
    "crates/x3-dex/src/tests/attack_liquidation_frontrun.rs"
  ],
  "timestamp": "2026-04-30T16:51:11.324232271Z",
  "result": {
    "claim_id": "x3.dex.liquidity_provision",
    "claim": "DEX economic attack resistance",
    "status": "verified",
    "proof_level": "P6",
    "edge_case_level": "E7",
    "hack_level": "H8",
    "operator_level": "I6",
    "degraded_level": "D5",
    "files_inspected": [
      "crates/x3-dex/src/lib.rs",
      "crates/x3-dex/src/tests/attack_sandwich.rs",
      "crates/x3-dex/src/tests/attack_liquidation_frontrun.rs"
    ],
    "commands_run": [
      "cargo test -p x3-dex attack_ -- --nocapture"
    ],
    "passed_checks": [
      "sandwich_attack_profit_bounded_by_slippage passed",
      "liquidation_frontrun_eliminated_by_fair_ordering passed"
    ],
    "failed_checks": [],
    "missing_proofs": [],
    "blockers": [],
    "score": 1.0,
    "evidence": {
      "failed_attack_tests": "0",
      "expected_attack_tests": "2",
      "passed_attack_tests": "2"
    },
    "timestamp": "2026-04-30T16:51:11.319516298Z",
    "duration_ms": 1862
  },
  "limitations": [],
  "binding_hash": "dad582cf8a8daac023852689ff0c9520f31025146439c03d2db612be74c8dd99"
}