{
  "repo_commit_hash": "2e0c3bdac9de8b60b05daa3bfdc545362d726150",
  "command_run": "x3-proof verify x3.dex.amm_math_safety",
  "artifact_hash": "a30ef655a6e05d603148a95d2ca558f9070bdb22099f931cf76419386374beec",
  "policy_hash": "a9560e648e6673ee0512a7122dd3518720b654814ce0f4e8d8327dc18379237a",
  "relevant_files": [
    "crates/x3-dex/src/lib.rs",
    "crates/x3-dex/src/tests/attack_sandwich.rs",
    "crates/x3-dex/src/tests/attack_liquidation_frontrun.rs"
  ],
  "timestamp": "2026-05-02T02:29:58.477183795Z",
  "result": {
    "claim_id": "x3.dex.amm_math_safety",
    "claim": "DEX economic attack resistance",
    "status": "verified",
    "proof_level": "P6",
    "edge_case_level": "E7",
    "hack_level": "H8",
    "operator_level": "I6",
    "degraded_level": "D5",
    "files_inspected": [
      "crates/x3-dex/src/lib.rs",
      "crates/x3-dex/src/tests/attack_sandwich.rs",
      "crates/x3-dex/src/tests/attack_liquidation_frontrun.rs"
    ],
    "commands_run": [
      "cargo test -p x3-dex attack_ -- --nocapture"
    ],
    "passed_checks": [
      "sandwich_attack_profit_bounded_by_slippage passed",
      "liquidation_frontrun_eliminated_by_fair_ordering passed"
    ],
    "failed_checks": [],
    "missing_proofs": [],
    "blockers": [],
    "score": 1.0,
    "evidence": {
      "expected_attack_tests": "2",
      "passed_attack_tests": "2",
      "failed_attack_tests": "0"
    },
    "timestamp": "2026-05-02T02:29:58.472871574Z",
    "duration_ms": 26406
  },
  "limitations": [],
  "binding_hash": "7107ddebdb5da3dabad0cd2a1a358b7fc2991d29095d83f47e479a089ff91d14"
}