{
  "repo_commit_hash": "5d62a4ec9d01984087bb3b6aafe71a4879b81c13",
  "command_run": "x3-proof verify x3.contracts.some_unimplemented",
  "artifact_hash": "e3b0c44298fc1c149afbf4c8996fb92427ae41e4649b934ca495991b7852b855",
  "policy_hash": "a9560e648e6673ee0512a7122dd3518720b654814ce0f4e8d8327dc18379237a",
  "relevant_files": [],
  "timestamp": "2026-05-02T01:49:18.502570488Z",
  "result": {
    "claim_id": "x3.contracts.some_unimplemented",
    "claim": "x3.contracts.some_unimplemented (no evidence-driven runner)",
    "status": "unverified",
    "proof_level": null,
    "edge_case_level": null,
    "hack_level": null,
    "operator_level": null,
    "degraded_level": null,
    "files_inspected": [],
    "commands_run": [],
    "passed_checks": [],
    "failed_checks": [
      "x3.contracts.some_unimplemented: no runner implemented; refusing to fabricate Verified"
    ],
    "missing_proofs": [
      "Add a runner for x3.contracts.some_unimplemented that drives executable evidence"
    ],
    "blockers": [],
    "score": 0.0,
    "evidence": {
      "reason": "no runner implemented for this claim id yet"
    },
    "timestamp": "2026-05-02T01:49:18.497903454Z",
    "duration_ms": 0
  },
  "limitations": [
    "Add a runner for x3.contracts.some_unimplemented that drives executable evidence"
  ],
  "binding_hash": "fac68ccf7bd2878c8278047365254eb4f344dede24ec77b311c948b8673a1167"
}