{
  "repo_commit_hash": "55bbd9db5a3e7dfb5d79d4257a972771d3fc25f7",
  "command_run": "x3-proof verify x3.flashloans.attack_resistance",
  "artifact_hash": "b06c6b6e310c08f269cb337a403cdb424bc0b68d69deb2e4428e9d6df1f4750c",
  "policy_hash": "a9560e648e6673ee0512a7122dd3518720b654814ce0f4e8d8327dc18379237a",
  "relevant_files": [
    "crates/x3-flashloan/src/lib.rs",
    "crates/x3-flashloan/src/tests/attack_oracle_manipulation.rs",
    "crates/x3-flashloan/src/tests/attack_reentrancy.rs",
    "crates/x3-flashloan/src/tests/attack_repayment_bypass.rs",
    "X3-contracts/shared/parity-core/src/lib.rs",
    "X3-contracts/shared/parity-core/tests/parity_vectors.rs",
    "X3-contracts/shared/test-vectors/flashloan_repay_or_revert.json"
  ],
  "timestamp": "2026-04-28T21:10:32.859875969Z",
  "result": {
    "claim_id": "x3.flashloans.attack_resistance",
    "claim": "Flashloan attack resistance",
    "status": "verified",
    "proof_level": "P6",
    "edge_case_level": "E7",
    "hack_level": "H8",
    "operator_level": "I6",
    "degraded_level": "D5",
    "files_inspected": [
      "crates/x3-flashloan/src/lib.rs",
      "crates/x3-flashloan/src/tests/attack_oracle_manipulation.rs",
      "crates/x3-flashloan/src/tests/attack_reentrancy.rs",
      "crates/x3-flashloan/src/tests/attack_repayment_bypass.rs",
      "X3-contracts/shared/parity-core/src/lib.rs",
      "X3-contracts/shared/parity-core/tests/parity_vectors.rs",
      "X3-contracts/shared/test-vectors/flashloan_repay_or_revert.json"
    ],
    "commands_run": [
      "cargo test -p x3-flashloan attack_ -- --nocapture",
      "cargo test --manifest-path X3-contracts/shared/parity-core/Cargo.toml --test parity_vectors"
    ],
    "passed_checks": [
      "flash_loan_oracle_manipulation_fails passed",
      "flash_loan_reentrancy_rejected passed",
      "flash_loan_repayment_bypass_reverts passed",
      "X3-contracts parity vectors (flashloan/repay_or_revert) ok"
    ],
    "failed_checks": [],
    "missing_proofs": [],
    "blockers": [],
    "score": 1.0,
    "evidence": {
      "failed_attack_tests": "0",
      "passed_attack_tests": "3",
      "parity_vector_harness": "ok",
      "expected_attack_tests": "3"
    },
    "timestamp": "2026-04-28T21:10:32.856097412Z",
    "duration_ms": 1200
  },
  "limitations": [],
  "binding_hash": "0c73331163c3d53dae6f501fde8b5afaaa68cafd50493bfd9199c6617e5c23a2"
}