{
  "repo_commit_hash": "2e0c3bdac9de8b60b05daa3bfdc545362d726150",
  "command_run": "x3-proof verify x3.governance.proof_gated_upgrade",
  "artifact_hash": "7347440e77f82d50c8faa9d3313d02c6fd43259a12e08a8d4c090035d37bdf36",
  "policy_hash": "a9560e648e6673ee0512a7122dd3518720b654814ce0f4e8d8327dc18379237a",
  "relevant_files": [
    "pallets/governance/src/lib.rs",
    "pallets/governance/src/tests.rs"
  ],
  "timestamp": "2026-05-02T01:56:12.673203204Z",
  "result": {
    "claim_id": "x3.governance.proof_gated_upgrade",
    "claim": "Governance flash-loan takeover resistance",
    "status": "verified",
    "proof_level": "P7",
    "edge_case_level": "E8",
    "hack_level": "H8",
    "operator_level": "I8",
    "degraded_level": "D6",
    "files_inspected": [
      "pallets/governance/src/lib.rs",
      "pallets/governance/src/tests.rs"
    ],
    "commands_run": [
      "cargo test -p pallet-governance flash_loan_governance -- --nocapture"
    ],
    "passed_checks": [
      "flash_loan_governance_takeover_fails passed"
    ],
    "failed_checks": [],
    "missing_proofs": [],
    "blockers": [],
    "score": 1.0,
    "evidence": {
      "expected_attack_tests": "1",
      "passed_attack_tests": "1",
      "failed_attack_tests": "0"
    },
    "timestamp": "2026-05-02T01:56:12.663459279Z",
    "duration_ms": 100978
  },
  "limitations": [],
  "binding_hash": "29d5423b40df3a9180734f692612b5ba53327a5f30c84af2051b1eba7522df87"
}