{
  "repo_commit_hash": "2e0c3bdac9de8b60b05daa3bfdc545362d726150",
  "command_run": "x3-proof verify x3.x3lang.compiler_reproducibility",
  "artifact_hash": "b4b0e454e83efcd703e36bf5df1528784732bdba89734437b311cda4222f2bed",
  "policy_hash": "a9560e648e6673ee0512a7122dd3518720b654814ce0f4e8d8327dc18379237a",
  "relevant_files": [
    "x3-lang/Cargo.toml",
    "x3-lang/compiler/Cargo.toml",
    "x3-lang/vm/Cargo.toml",
    "x3-lang/tests/verify_bytecode.rs",
    "docs/x3-lang/README.md"
  ],
  "timestamp": "2026-05-02T02:00:25.124801172Z",
  "result": {
    "claim_id": "x3.x3lang.compiler_reproducibility",
    "claim": "X3Language compiler/VM/test artifacts are present",
    "status": "verified",
    "proof_level": "P5",
    "edge_case_level": "E6",
    "hack_level": "H7",
    "operator_level": "I6",
    "degraded_level": "D5",
    "files_inspected": [
      "x3-lang/Cargo.toml",
      "x3-lang/compiler/Cargo.toml",
      "x3-lang/vm/Cargo.toml",
      "x3-lang/tests/verify_bytecode.rs",
      "docs/x3-lang/README.md"
    ],
    "commands_run": [],
    "passed_checks": [
      "x3-lang workspace manifest exists",
      "x3-lang compiler crate exists",
      "x3-lang VM crate exists",
      "x3-lang bytecode verification test exists",
      "x3-lang docs entry exists"
    ],
    "failed_checks": [],
    "missing_proofs": [],
    "blockers": [],
    "score": 1.0,
    "evidence": {
      "x3-lang/Cargo.toml": "true",
      "x3-lang/vm/Cargo.toml": "true",
      "x3-lang/compiler/Cargo.toml": "true",
      "x3-lang/tests/verify_bytecode.rs": "true",
      "docs/x3-lang/README.md": "true"
    },
    "timestamp": "2026-05-02T02:00:25.119871482Z",
    "duration_ms": 0
  },
  "limitations": [],
  "binding_hash": "412bc2b9f5c0da4e63be5f43d492b0a9b6dce8e6655b9b34010948407ee9eac1"
}