{
  "repo_commit_hash": "db91e2e35a36cb2c04efafd3906476f192e5e83c",
  "command_run": "x3-proof verify x3.onboarding.developer_first_value",
  "artifact_hash": "7dabcbab31da7625e29134e813256a0251b23837cfed2fee6771bb6d63319d28",
  "policy_hash": "a9560e648e6673ee0512a7122dd3518720b654814ce0f4e8d8327dc18379237a",
  "relevant_files": [
    "MAINNET_QUICK_START.md",
    "OPTION_D_LAUNCH_GUIDE.md",
    "docs/BLOCKCHAIN_STARTUP_GUIDE.md",
    "README.md",
    "Makefile",
    "Cargo.toml"
  ],
  "timestamp": "2026-04-27T23:21:23.295329355Z",
  "result": {
    "claim_id": "x3.onboarding.developer_first_value",
    "claim": "A fresh developer can deploy and test a first X3 app with measured time-to-first-value",
    "status": "partial",
    "proof_level": null,
    "edge_case_level": null,
    "hack_level": null,
    "operator_level": null,
    "degraded_level": null,
    "files_inspected": [
      "MAINNET_QUICK_START.md",
      "OPTION_D_LAUNCH_GUIDE.md",
      "docs/BLOCKCHAIN_STARTUP_GUIDE.md",
      "README.md",
      "Makefile",
      "Cargo.toml"
    ],
    "commands_run": [],
    "passed_checks": [
      "Quickstart guide found: MAINNET_QUICK_START.md",
      "Makefile present (dev entry point)",
      "Node crate referenced in workspace Cargo.toml"
    ],
    "failed_checks": [],
    "missing_proofs": [
      "No measured time-to-first-value benchmark — add a CI step that times `cargo build` + node startup + first block"
    ],
    "blockers": [],
    "score": 1.0,
    "evidence": {
      "makefile": "present",
      "quickstart_doc": "MAINNET_QUICK_START.md"
    },
    "timestamp": "2026-04-27T23:21:23.289419500Z",
    "duration_ms": 0
  },
  "limitations": [
    "No measured time-to-first-value benchmark — add a CI step that times `cargo build` + node startup + first block"
  ],
  "binding_hash": "83cf829ad3e1d5fe0beab9e5301e3993f1862b34a42a8c671b2ca92d203b7d2e"
}